{"event_maxima":{"actual_direct_events":0,"queue_overflow_events":0,"reserved_state_events":0},"event_totals":{"actual_direct_events":0,"queue_overflow_events":0,"reserved_state_events":0},"invariant_pass_records":96,"kind":"m16_zero_event_qualification","layer":"rtl","milestone":"M19 — Machine-Readable M16 Execution and Qualification Evidence","record_count":96,"record_digest":"3f730a3d088e4d75fdd1631dd234878a6acd3a7561cb463e19c815096c04fe6a","schema":"frp.m16.zero_event_qualification.v2.1.0","status":"PASS","trace_path":"artifacts/m19/execution/m16-rtl-execution-trace.json","version":"2.1.0"}
