{"event_maxima":{"actual_direct_events":0,"queue_overflow_events":0,"reserved_state_events":0},"event_totals":{"actual_direct_events":0,"queue_overflow_events":0,"reserved_state_events":0},"invariant_pass_records":4,"kind":"m16_zero_event_qualification","layer":"fpga_preparation","milestone":"M19 — Machine-Readable M16 Execution and Qualification Evidence","record_count":4,"record_digest":"4b2e8aec64a0b3cb76d0819383ed66d306b8e50dc3feb7bb8c6c76486cd83d57","schema":"frp.m16.zero_event_qualification.v2.1.0","status":"PASS","trace_path":"artifacts/m19/execution/m16-fpga-preparation-execution-trace.json","version":"2.1.0"}
